{
  "task_id": "task_002",
  "title": "Run broader utility regression test",
  "description": "Verify that adding slugify_title does not break other utility helpers.",
  "allowed_files": [
    "tests/test_text_utils.py"
  ],
  "forbidden_files": [
    ".github/**",
    "infra/**",
    ".env",
    "requirements.txt"
  ],
  "acceptance": [
    {
      "id": "acc_003",
      "description": "All utility tests pass",
      "type": "test",
      "command": "pytest tests/test_text_utils.py tests/test_helpers.py -q",
      "required": true
    }
  ],
  "test_commands": [
    "pytest tests/test_text_utils.py tests/test_helpers.py -q"
  ],
  "retry_count": 0,
  "max_retries": 2,
  "stop_condition": "Pass all required acceptance checks without editing forbidden files."
}
